{
  "$schema": "https://json-schema.org/draft/2020-12/schema", "$id": "https://synapse.kkloudtarus.net/docs/schemas/events/approval.requested.v1.schema.json", "title": "approval.requested event (v1)", "description": "A governed approval was requested.", "type": "object",
  "properties": {"id": {"type": "string", "minLength": 1}, "type": {"type": "string", "const": "approval.requested"}, "source_kind": {"type": "string", "minLength": 1}, "source_id": {"type": "string", "minLength": 1}, "schema_version": {"type": "integer", "const": 1}, "occurred_at": {"type": "string", "format": "date-time"}, "engagement_id": {"type": "string"}, "data": {"type": "object", "properties": {"title": {"type": "string"}, "summary": {"type": "string"}, "approval_id": {"type": "string", "minLength": 1}, "engagement_id": {"type": "string", "minLength": 1}, "lead_user_id": {"type": "string"}, "kind": {"type": "string", "enum": ["agent", "response"]}, "status": {"type": "string"}, "decision": {"type": "string"}, "expires_at": {"type": "string", "format": "date-time"}, "actor": {"type": "string"}, "engagement_name": {"type": "string"}, "approver_count": {"type": "integer", "minimum": 0}}, "required": ["title", "summary", "approval_id", "engagement_id", "kind", "status"], "additionalProperties": true}},
  "required": ["id", "type", "source_kind", "source_id", "schema_version", "occurred_at", "data"], "additionalProperties": true
}
