{"id":"event-approval-requested","type":"approval.requested","source_kind":"approval","source_id":"approval-42","schema_version":1,"occurred_at":"2026-10-14T08:00:00Z","engagement_id":"eng-42","data":{"title":"Approval requested","summary":"A response approval needs review.","approval_id":"approval-42","engagement_id":"eng-42","lead_user_id":"user-42","kind":"response","status":"pending","expires_at":"2026-10-15T08:00:00Z","actor":"system","engagement_name":"October assessment","approver_count":1}}
